[
  {
    "fy": 2023,
    "months": 3.3,
    "cutDate": null,
    "fyToDate": false,
    "sourceUrl": "https://egov.uscis.gov/processing-times/historic-pt",
    "evidence": "S-sec"
  },
  {
    "fy": 2024,
    "months": 4.6,
    "cutDate": null,
    "fyToDate": false,
    "sourceUrl": "https://egov.uscis.gov/processing-times/historic-pt",
    "evidence": "S-sec"
  },
  {
    "fy": 2025,
    "months": 7.0,
    "cutDate": null,
    "fyToDate": false,
    "sourceUrl": "https://egov.uscis.gov/processing-times/historic-pt",
    "evidence": "S-sec"
  },
  {
    "fy": 2026,
    "months": 11.8,
    "cutDate": "2026-07-31",
    "fyToDate": true,
    "sourceUrl": "https://egov.uscis.gov/processing-times/historic-pt",
    "evidence": "S-sec"
  },
  {
    "fy": 2026,
    "months": 12.3,
    "cutDate": "2026-08-30",
    "fyToDate": true,
    "sourceUrl": "https://egov.uscis.gov/processing-times/historic-pt",
    "evidence": "S-sec"
  }
]
